{
  "code": "DRC_CLEARANCE",
  "title": "Порушення зазору (KiCad DRC)",
  "category": "drc",
  "severity": "error",
  "summary": "Мідь двох різних ланцюгів ближче, ніж дозволяє клас ланцюгів.",
  "description": "Це вбудована перевірка KiCad. Перевіряч запускає `kicad-cli pcb drc --format json` і перекладає кожне порушення `clearance` у знахідку `DRC_CLEARANCE` з координатою й описом. Поріг задається в правилах проекту та класах ланцюгів KiCad, а не тут.",
  "why": "Зазор менший за технологічний мінімум виробника дає коротке замикання після травлення або з часом (міграція міді, вологість).",
  "fix": "Розсуньте траси або зменшіть ширину в тісному місці. Для QFP з кроком 0.5 мм проходьте між площадками тільки якщо виробник підтверджує 0.1/0.1 мм.",
  "params": [],
  "checker": {
    "engine": "kicad-drc",
    "function": "clearance",
    "measures": "мінімальна відстань між мідними об'єктами різних ланцюгів"
  },
  "check": {
    "kernel": "kicad_drc",
    "emits": "DRC_CLEARANCE",
    "args": {}
  },
  "tags": [
    "DRC",
    "зазор",
    "KiCad"
  ],
  "references": [
    {
      "title": "KiCad: Custom design rules",
      "url": "https://docs.kicad.org/master/en/pcbnew/pcbnew.html#custom_design_rules"
    }
  ],
  "examples": {
    "bad": {
      "w": 16,
      "h": 8,
      "verdict": "bad",
      "caption": "Дві траси на відстані 0.08 мм при мінімумі 0.15 мм.",
      "items": [
        {
          "t": "board",
          "x": 0,
          "y": 0,
          "w": 16,
          "h": 8
        },
        {
          "t": "track",
          "pts": [
            [
              2,
              3.7
            ],
            [
              14,
              3.7
            ]
          ],
          "w": 0.25,
          "layer": "F",
          "net": "A",
          "bad": true
        },
        {
          "t": "track",
          "pts": [
            [
              2,
              4.05
            ],
            [
              14,
              4.05
            ]
          ],
          "w": 0.25,
          "layer": "F",
          "net": "B",
          "bad": true
        },
        {
          "t": "mark",
          "x": 8,
          "y": 3.9,
          "r": 1.2
        }
      ]
    },
    "good": {
      "w": 16,
      "h": 8,
      "verdict": "good",
      "caption": "Зазор 0.2 мм.",
      "items": [
        {
          "t": "board",
          "x": 0,
          "y": 0,
          "w": 16,
          "h": 8
        },
        {
          "t": "track",
          "pts": [
            [
              2,
              3.5
            ],
            [
              14,
              3.5
            ]
          ],
          "w": 0.25,
          "layer": "F",
          "net": "A"
        },
        {
          "t": "track",
          "pts": [
            [
              2,
              4.5
            ],
            [
              14,
              4.5
            ]
          ],
          "w": 0.25,
          "layer": "F",
          "net": "B"
        },
        {
          "t": "dim",
          "x1": 8,
          "y1": 3.63,
          "x2": 8,
          "y2": 4.37,
          "text": ""
        }
      ]
    }
  },
  "enabled": true
}
