{
  "code": "VIA_IN_PAD",
  "title": "Перехідний отвір у SMD-площадці",
  "category": "manufacturing",
  "severity": "warning",
  "summary": "Звичайний перехід усередині площадки для пайки витягує припій і лишає площадку сухою.",
  "description": "Перевіряч порівнює центр кожного перехідного отвору з прямокутником кожної SMD-площадки. Якщо центр усередині, видається попередження. Наскрізні площадки ігноруються.",
  "why": "Під час оплавлення припій по капілярах іде в отвір, і на площадці його не вистачає: холодна пайка або взагалі відсутній контакт. Виняток — заповнені та закриті переходи (via-in-pad, filled & capped), але це окрема, дорожча технологія.",
  "fix": "Винесіть перехід за межі площадки на 0.3–0.5 мм і з'єднайте коротким сегментом. Якщо via-in-pad потрібен (BGA), замовляйте плату з заповненням отворів і позначте це в стеку.",
  "params": [],
  "checker": {
    "engine": "pcbagent",
    "function": "check_via_in_pad",
    "measures": "центр переходу всередині габариту SMD-площадки"
  },
  "check": {
    "kernel": "via_in_pad",
    "emits": "VIA_IN_PAD",
    "args": {}
  },
  "tags": [
    "пайка",
    "DFM",
    "перехідні отвори"
  ],
  "references": [
    {
      "title": "IPC-7093 Design and Assembly Process Implementation for BGA"
    }
  ],
  "examples": {
    "bad": {
      "w": 16,
      "h": 8,
      "verdict": "bad",
      "caption": "Перехід GND просто в площадці конденсатора.",
      "items": [
        {
          "t": "board",
          "x": 0,
          "y": 0,
          "w": 16,
          "h": 8
        },
        {
          "t": "part",
          "x": 5,
          "y": 3,
          "w": 3,
          "h": 1.6,
          "label": "C1",
          "kind": "cap"
        },
        {
          "t": "pad",
          "x": 5.5,
          "y": 3.8,
          "w": 0.9,
          "h": 1.2,
          "net": "GND"
        },
        {
          "t": "pad",
          "x": 7.5,
          "y": 3.8,
          "w": 0.9,
          "h": 1.2,
          "net": "VDD"
        },
        {
          "t": "via",
          "x": 5.5,
          "y": 3.8,
          "net": "GND",
          "bad": true
        },
        {
          "t": "mark",
          "x": 5.5,
          "y": 3.8,
          "r": 1.3
        }
      ]
    },
    "good": {
      "w": 16,
      "h": 8,
      "verdict": "good",
      "caption": "Перехід поруч, з'єднаний коротким сегментом.",
      "items": [
        {
          "t": "board",
          "x": 0,
          "y": 0,
          "w": 16,
          "h": 8
        },
        {
          "t": "part",
          "x": 5,
          "y": 3,
          "w": 3,
          "h": 1.6,
          "label": "C1",
          "kind": "cap"
        },
        {
          "t": "pad",
          "x": 5.5,
          "y": 3.8,
          "w": 0.9,
          "h": 1.2,
          "net": "GND"
        },
        {
          "t": "pad",
          "x": 7.5,
          "y": 3.8,
          "w": 0.9,
          "h": 1.2,
          "net": "VDD"
        },
        {
          "t": "track",
          "pts": [
            [
              5.5,
              3.8
            ],
            [
              4.2,
              3.8
            ]
          ],
          "w": 0.3,
          "layer": "F",
          "net": "GND"
        },
        {
          "t": "via",
          "x": 4.2,
          "y": 3.8,
          "net": "GND"
        }
      ]
    }
  },
  "enabled": true
}
