{
  "code": "ACUTE_ANGLE",
  "title": "Гострий кут у з'єднанні трас",
  "category": "manufacturing",
  "severity": "warning",
  "summary": "Кут між двома сегментами однієї траси менший за 90° створює кислотну пастку.",
  "description": "Перевіряч групує кінці сегментів за ланцюгом, шаром і координатою. Там, де сходяться рівно два сегменти, обчислюється кут між ними; менший за `acute_angle_deg` — попередження.\n\nЗ'єднання, що лежать усередині площадки того ж ланцюга (дві доріжки виходять з однієї площадки), не рахуються: мідь площадки заповнює кут.",
  "why": "У гострому куті травильний розчин застоюється й продовжує їсти мідь після того, як решта плати вже готова. Траса в цьому місці стає тоншою або обривається. Крім того, гострий кут — це імпедансна неоднорідність для швидких сигналів.",
  "fix": "Перерозведіть з кутами 90° або 135° (два повороти по 45°). У KiCad інтерактивний роутер у режимі 45° сам не робить гострих кутів, вони зазвичай з'являються після ручного редагування або імпорту з автотрасувальника.",
  "params": [
    {
      "key": "acute_angle_deg",
      "label": "Поріг кута",
      "unit": "°",
      "type": "number",
      "default": 89,
      "min": 30,
      "max": 90,
      "step": 1
    }
  ],
  "checker": {
    "engine": "pcbagent",
    "function": "check_acute_angles",
    "measures": "кут між двома сегментами, що сходяться в одній точці на одному шарі"
  },
  "check": {
    "kernel": "acute_angles",
    "emits": "ACUTE_ANGLE",
    "args": {}
  },
  "tags": [
    "кислотна пастка",
    "DFM",
    "виробництво"
  ],
  "references": [
    {
      "title": "IPC-2221B, розділ 9.1 (Conductor routing)"
    }
  ],
  "examples": {
    "bad": {
      "w": 20,
      "h": 10,
      "verdict": "bad",
      "caption": "Сегменти сходяться під 40°: кислотна пастка.",
      "items": [
        {
          "t": "board",
          "x": 0,
          "y": 0,
          "w": 20,
          "h": 10
        },
        {
          "t": "track",
          "pts": [
            [
              2,
              8
            ],
            [
              12,
              3
            ],
            [
              2,
              2
            ]
          ],
          "w": 0.3,
          "layer": "F",
          "net": "SIG",
          "bad": true
        },
        {
          "t": "mark",
          "x": 12,
          "y": 3,
          "r": 1.4,
          "text": "40°"
        }
      ]
    },
    "good": {
      "w": 20,
      "h": 10,
      "verdict": "good",
      "caption": "Поворот через 135°, кут тупий.",
      "items": [
        {
          "t": "board",
          "x": 0,
          "y": 0,
          "w": 20,
          "h": 10
        },
        {
          "t": "track",
          "pts": [
            [
              2,
              8
            ],
            [
              9,
              8
            ],
            [
              12,
              5
            ],
            [
              12,
              2
            ]
          ],
          "w": 0.3,
          "layer": "F",
          "net": "SIG"
        },
        {
          "t": "label",
          "x": 9.5,
          "y": 9.5,
          "text": "135°",
          "size": 1
        }
      ]
    }
  },
  "enabled": true
}
