{
  "code": "TRACK_UNDER_CRYSTAL",
  "title": "Чужі траси під кварцом",
  "category": "clock",
  "severity": "warning",
  "summary": "Під кварцом і його трасами має бути тільки суцільна земля.",
  "description": "Перевіряч бере габарит кожного кварцу й шукає траси інших (не GND і не власних) ланцюгів, що проходять через нього на будь-якому шарі.",
  "why": "Кварцовий контур високоомний і легко ловить перехресні наводки. Швидкий сигнал під кварцом модулює тактову частоту (джитер), а зворотній зв'язок може навпаки вивести гармоніки кварцу на чужу трасу, наприклад на антену або АЦП.",
  "fix": "Перенесіть чужі траси за межі кварцової зони. Заведіть у KiCad rule-area «keepout» під кварцом для трас і переходів, лишивши тільки GND.",
  "params": [],
  "checker": {
    "engine": "pcbagent",
    "function": "check_tracks_under_crystal",
    "measures": "перетин трас чужих ланцюгів з габаритом кварцу"
  },
  "check": {
    "kernel": "tracks_under_crystal",
    "emits": "TRACK_UNDER_CRYSTAL",
    "args": {}
  },
  "tags": [
    "кварц",
    "наводки",
    "keepout"
  ],
  "references": [],
  "examples": {
    "bad": {
      "w": 20,
      "h": 12,
      "verdict": "bad",
      "caption": "SPI_CLK проходить по B.Cu прямо під Y1.",
      "items": [
        {
          "t": "board",
          "x": 0,
          "y": 0,
          "w": 20,
          "h": 12
        },
        {
          "t": "zone",
          "x": 0.5,
          "y": 0.5,
          "w": 19,
          "h": 11,
          "layer": "B",
          "net": "GND"
        },
        {
          "t": "part",
          "x": 8,
          "y": 4.5,
          "w": 3.2,
          "h": 2.5,
          "label": "Y1",
          "kind": "xtal"
        },
        {
          "t": "track",
          "pts": [
            [
              2,
              5.7
            ],
            [
              18,
              5.7
            ]
          ],
          "w": 0.25,
          "layer": "B",
          "net": "SPI_CLK",
          "bad": true
        },
        {
          "t": "mark",
          "x": 9.6,
          "y": 5.7,
          "r": 2.2
        }
      ]
    },
    "good": {
      "w": 20,
      "h": 12,
      "verdict": "good",
      "caption": "Сигнал обходить зону кварцу; під ним лише GND.",
      "items": [
        {
          "t": "board",
          "x": 0,
          "y": 0,
          "w": 20,
          "h": 12
        },
        {
          "t": "zone",
          "x": 0.5,
          "y": 0.5,
          "w": 19,
          "h": 11,
          "layer": "B",
          "net": "GND"
        },
        {
          "t": "keepout",
          "x": 6.5,
          "y": 3,
          "w": 6.2,
          "h": 5.5,
          "label": "keepout"
        },
        {
          "t": "part",
          "x": 8,
          "y": 4.5,
          "w": 3.2,
          "h": 2.5,
          "label": "Y1",
          "kind": "xtal"
        },
        {
          "t": "track",
          "pts": [
            [
              2,
              5.7
            ],
            [
              5,
              5.7
            ],
            [
              5,
              10
            ],
            [
              14,
              10
            ],
            [
              14,
              5.7
            ],
            [
              18,
              5.7
            ]
          ],
          "w": 0.25,
          "layer": "F",
          "net": "SPI_CLK"
        }
      ]
    }
  },
  "enabled": true
}
