{
  "code": "ZONE_UNFILLED",
  "title": "Зона не залита",
  "category": "ground",
  "severity": "warning",
  "summary": "Полігон існує, але не залитий: DRC і зв'язність рахуються без нього.",
  "description": "Перевіряч перебирає всі зони (крім rule-area) і повідомляє про ті, у яких немає заливки. Після будь-яких змін трас KiCad позначає зони як застарілі; DRC з незалитими зонами дає хибні «не з'єднано».",
  "why": "Незалита зона — це просто контур. Усі площадки GND, які мали з'єднуватися через полігон, лишаються висячими, і плата піде у виробництво з розривами.",
  "fix": "Натисніть **B** (Refill zones) у редакторі плати або викличте `refill_zones` через API перед перевіркою. Увімкніть автоматичне перезаливання в налаштуваннях DRC.",
  "params": [],
  "checker": {
    "engine": "pcbagent",
    "function": "check_zones",
    "measures": "прапорець filled кожної зони"
  },
  "check": {
    "kernel": "zones",
    "emits": "ZONE_UNFILLED",
    "args": {}
  },
  "tags": [
    "зона",
    "полігон",
    "DRC"
  ],
  "references": [],
  "examples": {
    "bad": {
      "w": 20,
      "h": 12,
      "verdict": "bad",
      "caption": "Контур зони є, заливки немає, площадки GND висять.",
      "items": [
        {
          "t": "board",
          "x": 0,
          "y": 0,
          "w": 20,
          "h": 12
        },
        {
          "t": "keepout",
          "x": 0.5,
          "y": 0.5,
          "w": 19,
          "h": 11,
          "label": "GND (не залито)"
        },
        {
          "t": "part",
          "x": 4,
          "y": 4,
          "w": 3,
          "h": 1.5,
          "label": "C1",
          "kind": "cap"
        },
        {
          "t": "pad",
          "x": 4.4,
          "y": 4.75,
          "w": 0.7,
          "h": 1,
          "net": "GND"
        },
        {
          "t": "pad",
          "x": 6.6,
          "y": 4.75,
          "w": 0.7,
          "h": 1,
          "net": "VDD"
        },
        {
          "t": "mark",
          "x": 4.4,
          "y": 4.75,
          "r": 1.2,
          "text": "не з'єднано"
        }
      ]
    },
    "good": {
      "w": 20,
      "h": 12,
      "verdict": "good",
      "caption": "Зона залита, площадка GND з'єднана термальним переходом.",
      "items": [
        {
          "t": "board",
          "x": 0,
          "y": 0,
          "w": 20,
          "h": 12
        },
        {
          "t": "zone",
          "x": 0.5,
          "y": 0.5,
          "w": 19,
          "h": 11,
          "layer": "F",
          "net": "GND"
        },
        {
          "t": "part",
          "x": 4,
          "y": 4,
          "w": 3,
          "h": 1.5,
          "label": "C1",
          "kind": "cap"
        },
        {
          "t": "pad",
          "x": 4.4,
          "y": 4.75,
          "w": 0.7,
          "h": 1,
          "net": "GND"
        },
        {
          "t": "pad",
          "x": 6.6,
          "y": 4.75,
          "w": 0.7,
          "h": 1,
          "net": "VDD"
        },
        {
          "t": "track",
          "pts": [
            [
              4.4,
              4.75
            ],
            [
              3.2,
              4.75
            ]
          ],
          "w": 0.3,
          "layer": "F",
          "net": "GND"
        },
        {
          "t": "track",
          "pts": [
            [
              4.4,
              4.75
            ],
            [
              4.4,
              6.2
            ]
          ],
          "w": 0.3,
          "layer": "F",
          "net": "GND"
        }
      ]
    }
  },
  "enabled": true
}
