{
  "code": "TRACK_BELOW_MIN",
  "title": "Траса вужча за мінімум плати",
  "category": "manufacturing",
  "severity": "error",
  "summary": "Ширина сегмента менша за min_track_width з правил проекту.",
  "description": "Перевіряч читає `min_track_width` з файлу проекту `.kicad_pro` і перелічує сегменти, вужчі за нього. Дублює перевірку KiCad DRC, але працює і без збереження файлу.",
  "why": "Виробник не гарантує траси тонші за свій мінімум (типово 0.1–0.15 мм). Такі траси травляться нерівномірно, обриваються або замикаються на сусідів.",
  "fix": "Розширте сегменти або змініть мінімум у правилах проекту, якщо виробник справді робить тонше.",
  "params": [],
  "checker": {
    "engine": "pcbagent",
    "function": "check_min_widths",
    "measures": "ширина сегмента проти min_track_width з проекту"
  },
  "check": {
    "kernel": "min_widths",
    "emits": "TRACK_BELOW_MIN",
    "args": {}
  },
  "tags": [
    "DFM",
    "ширина траси"
  ],
  "references": [],
  "examples": {
    "bad": {
      "w": 16,
      "h": 8,
      "verdict": "bad",
      "caption": "Сегмент 0.1 мм при мінімумі 0.15 мм.",
      "items": [
        {
          "t": "board",
          "x": 0,
          "y": 0,
          "w": 16,
          "h": 8
        },
        {
          "t": "track",
          "pts": [
            [
              2,
              4
            ],
            [
              7,
              4
            ]
          ],
          "w": 0.3,
          "layer": "F",
          "net": "SIG"
        },
        {
          "t": "track",
          "pts": [
            [
              7,
              4
            ],
            [
              10,
              4
            ]
          ],
          "w": 0.1,
          "layer": "F",
          "net": "SIG",
          "bad": true
        },
        {
          "t": "track",
          "pts": [
            [
              10,
              4
            ],
            [
              14,
              4
            ]
          ],
          "w": 0.3,
          "layer": "F",
          "net": "SIG"
        },
        {
          "t": "dim",
          "x1": 7,
          "y1": 6,
          "x2": 10,
          "y2": 6,
          "text": "0.1 мм"
        }
      ]
    },
    "good": {
      "w": 16,
      "h": 8,
      "verdict": "good",
      "caption": "Одна ширина 0.3 мм по всій довжині.",
      "items": [
        {
          "t": "board",
          "x": 0,
          "y": 0,
          "w": 16,
          "h": 8
        },
        {
          "t": "track",
          "pts": [
            [
              2,
              4
            ],
            [
              14,
              4
            ]
          ],
          "w": 0.3,
          "layer": "F",
          "net": "SIG"
        }
      ]
    }
  },
  "enabled": true
}
