{
  "code": "OFF_BOARD",
  "title": "Компонент або траса поза контуром плати",
  "category": "mechanical",
  "severity": "error",
  "summary": "Габарит компонента чи кінець траси виходить за Edge.Cuts.",
  "description": "Перевіряч будує обмежувальний прямокутник контуру з Edge.Cuts і перевіряє габарити всіх компонентів та кінці всіх сегментів. Знахідки `OFF_BOARD` для компонентів і `TRACK_OFF_BOARD` для трас. Якщо контуру немає взагалі, видається `NO_OUTLINE`.",
  "why": "Усе поза контуром буде відрізане на виробництві. Зазвичай це компонент, який забули пересунути після зміни контуру, або траса, протягнута через край.",
  "fix": "Пересуньте компонент усередину з запасом на `min_copper_edge_clearance`. Для трас перевірте також відстань до краю (KiCad DRC copper-edge clearance).",
  "params": [],
  "checker": {
    "engine": "pcbagent",
    "function": "check_off_board",
    "measures": "габарит компонента і кінці сегментів проти прямокутника контуру"
  },
  "check": {
    "kernel": "off_board",
    "emits": "OFF_BOARD",
    "args": {}
  },
  "tags": [
    "контур",
    "механіка",
    "Edge.Cuts"
  ],
  "references": [],
  "examples": {
    "bad": {
      "w": 20,
      "h": 10,
      "verdict": "bad",
      "caption": "Роз'єм J1 наполовину за контуром.",
      "items": [
        {
          "t": "board",
          "x": 0,
          "y": 0,
          "w": 15,
          "h": 10
        },
        {
          "t": "part",
          "x": 13,
          "y": 3,
          "w": 5,
          "h": 4,
          "label": "J1",
          "kind": "conn"
        },
        {
          "t": "mark",
          "x": 15.5,
          "y": 5,
          "r": 2.5
        }
      ]
    },
    "good": {
      "w": 20,
      "h": 10,
      "verdict": "good",
      "caption": "Роз'єм всередині контуру з відступом.",
      "items": [
        {
          "t": "board",
          "x": 0,
          "y": 0,
          "w": 15,
          "h": 10
        },
        {
          "t": "part",
          "x": 9,
          "y": 3,
          "w": 5,
          "h": 4,
          "label": "J1",
          "kind": "conn"
        },
        {
          "t": "dim",
          "x1": 14,
          "y1": 8.5,
          "x2": 15,
          "y2": 8.5,
          "text": "1 мм"
        }
      ]
    }
  },
  "enabled": true
}
