{
  "code": "HIGH_CURRENT_WIDTH",
  "title": "Ширина траси за струмом (IPC-2221)",
  "category": "power",
  "severity": "warning",
  "summary": "Траса має витримувати заданий струм при допустимому нагріві.",
  "description": "Для ланцюгів, у яких у властивостях або в правилах класу задано струм, перевіряч рахує мінімальну ширину за формулою IPC-2221 для зовнішніх шарів:\n\n`I = k · ΔT^0.44 · A^0.725`, де `k = 0.048`, `A` — переріз у mil², `ΔT` — допустимий нагрів.\n\nДовідкова таблиця для зовнішніх шарів, мідь 35 µm (1 oz), ΔT = 10 °C (внутрішні шари потребують приблизно вдвічі ширше):\n\n| Струм | Ширина |\n|---|---|\n| 0.5 A | 0.12 мм |\n| 1 A | 0.3 мм |\n| 2 A | 0.78 мм |\n| 3 A | 1.37 мм |\n| 5 A | 2.77 мм |\n\nПоки що струм береться з параметра `current_by_net` (JSON-мапа ланцюг → ампери) або з класу ланцюгів; автоматичного визначення струму зі схеми немає.",
  "why": "Занадто вузька траса гріється, темніє й з часом вигорає, а до того падіння напруги на ній псує роботу навантаження. На платах з моторами, LED-стрічками, зарядкою це найчастіша причина повернень з поля.",
  "fix": "Розширте трасу або зробіть полігон. Якщо місця немає, продублюйте трасу на іншому шарі та з'єднайте рядом переходів (кожен перехід 0.3 мм ≈ 0.5–1 A). Для струмів понад 5 A розгляньте товщу мідь (70 µm).",
  "params": [
    {
      "key": "current_delta_t",
      "label": "Допустимий нагрів",
      "unit": "°C",
      "type": "number",
      "default": 10,
      "min": 1,
      "max": 45,
      "step": 1
    },
    {
      "key": "copper_thickness_um",
      "label": "Товщина міді",
      "unit": "µm",
      "type": "number",
      "default": 35,
      "min": 17,
      "max": 105,
      "step": 1
    },
    {
      "key": "current_by_net",
      "label": "Струм по ланцюгах (JSON)",
      "type": "string",
      "default": "{}",
      "description": "Напр. {\"VMOTOR\": 2.5, \"VBUS\": 1.5}"
    }
  ],
  "checker": {
    "engine": "pcbagent",
    "function": "check_current_width",
    "measures": "мінімальна ширина сегмента на ланцюзі проти ширини, обчисленої за IPC-2221 для заданого струму"
  },
  "check": {
    "kernel": "current_width",
    "emits": "HIGH_CURRENT_WIDTH",
    "args": {}
  },
  "tags": [
    "струм",
    "нагрів",
    "IPC-2221",
    "силова електроніка"
  ],
  "references": [
    {
      "title": "IPC-2221B Generic Standard on Printed Board Design"
    },
    {
      "title": "Saturn PCB Toolkit (калькулятор)",
      "url": "https://saturnpcb.com/saturn-pcb-toolkit/"
    }
  ],
  "examples": {
    "bad": {
      "w": 24,
      "h": 12,
      "verdict": "bad",
      "caption": "2 A через трасу 0.4 мм: нагрів набагато більший за 10 °C.",
      "items": [
        {
          "t": "board",
          "x": 0,
          "y": 0,
          "w": 24,
          "h": 12
        },
        {
          "t": "part",
          "x": 1,
          "y": 2,
          "w": 5,
          "h": 8,
          "label": "J1",
          "kind": "conn"
        },
        {
          "t": "pad",
          "x": 6.4,
          "y": 6,
          "w": 1.6,
          "h": 1.6,
          "net": "VMOT",
          "th": true,
          "label": "VMOT 2A"
        },
        {
          "t": "part",
          "x": 16,
          "y": 3,
          "w": 7,
          "h": 6,
          "label": "U3 driver",
          "kind": "ic"
        },
        {
          "t": "pad",
          "x": 15.6,
          "y": 6,
          "w": 0.8,
          "h": 0.6,
          "net": "VMOT"
        },
        {
          "t": "track",
          "pts": [
            [
              7.2,
              6
            ],
            [
              15.2,
              6
            ]
          ],
          "w": 0.4,
          "layer": "F",
          "net": "VMOT",
          "bad": true
        },
        {
          "t": "dim",
          "x1": 9,
          "y1": 9,
          "x2": 14,
          "y2": 9,
          "text": "0.4 мм, треба ≥ 0.78 мм"
        }
      ]
    },
    "good": {
      "w": 24,
      "h": 12,
      "verdict": "good",
      "caption": "Траса 1.5 мм плюс дубль на нижньому шарі через переходи.",
      "items": [
        {
          "t": "board",
          "x": 0,
          "y": 0,
          "w": 24,
          "h": 12
        },
        {
          "t": "part",
          "x": 1,
          "y": 2,
          "w": 5,
          "h": 8,
          "label": "J1",
          "kind": "conn"
        },
        {
          "t": "pad",
          "x": 6.4,
          "y": 6,
          "w": 1.6,
          "h": 1.6,
          "net": "VMOT",
          "th": true,
          "label": "VMOT 2A"
        },
        {
          "t": "part",
          "x": 16,
          "y": 3,
          "w": 7,
          "h": 6,
          "label": "U3 driver",
          "kind": "ic"
        },
        {
          "t": "pad",
          "x": 15.6,
          "y": 6,
          "w": 0.8,
          "h": 0.6,
          "net": "VMOT"
        },
        {
          "t": "track",
          "pts": [
            [
              7.2,
              6
            ],
            [
              15.2,
              6
            ]
          ],
          "w": 1.5,
          "layer": "B",
          "net": "VMOT"
        },
        {
          "t": "track",
          "pts": [
            [
              7.2,
              6
            ],
            [
              15.2,
              6
            ]
          ],
          "w": 1.5,
          "layer": "F",
          "net": "VMOT"
        },
        {
          "t": "via",
          "x": 8.5,
          "y": 6,
          "net": "VMOT"
        },
        {
          "t": "via",
          "x": 9.5,
          "y": 6,
          "net": "VMOT"
        },
        {
          "t": "via",
          "x": 13,
          "y": 6,
          "net": "VMOT"
        },
        {
          "t": "via",
          "x": 14,
          "y": 6,
          "net": "VMOT"
        },
        {
          "t": "dim",
          "x1": 9,
          "y1": 9,
          "x2": 14,
          "y2": 9,
          "text": "1.5 мм × 2 шари"
        }
      ]
    }
  },
  "enabled": true
}
