{
  "code": "DRC_SILK_OVER_COPPER",
  "title": "Шовкографія на площадці (KiCad DRC)",
  "category": "manufacturing",
  "severity": "warning",
  "summary": "Напис або контур шовкографії лягає на площадку для пайки.",
  "description": "Вбудована перевірка KiCad `silk_over_copper`. Виробник зазвичай сам обрізає шовкографію на площадках, але це робить написи нечитабельними, а на деяких фабриках фарба заважає пайці.",
  "why": "Фарба шовкографії не змочується припоєм. На площадці вона зменшує площу контакту; на позначеннях компонентів робить референс нечитабельним після монтажу.",
  "fix": "Пересуньте позначення (референс) або зменшіть шрифт. У KiCad: «Cleanup graphics» не допомагає, треба пересунути вручну або скриптом.",
  "params": [],
  "checker": {
    "engine": "kicad-drc",
    "function": "silk_over_copper",
    "measures": "перетин шовкографії з мідними площадками"
  },
  "check": {
    "kernel": "kicad_drc",
    "emits": "DRC_SILK_OVER_COPPER",
    "args": {}
  },
  "tags": [
    "DRC",
    "шовкографія",
    "DFM"
  ],
  "references": [],
  "examples": {
    "bad": {
      "w": 16,
      "h": 8,
      "verdict": "bad",
      "caption": "Референс R1 лежить на площадці.",
      "items": [
        {
          "t": "board",
          "x": 0,
          "y": 0,
          "w": 16,
          "h": 8
        },
        {
          "t": "part",
          "x": 5,
          "y": 3,
          "w": 3.2,
          "h": 1.6,
          "label": "",
          "kind": "res"
        },
        {
          "t": "pad",
          "x": 5.5,
          "y": 3.8,
          "w": 0.9,
          "h": 1.2,
          "net": "A"
        },
        {
          "t": "pad",
          "x": 7.7,
          "y": 3.8,
          "w": 0.9,
          "h": 1.2,
          "net": "B"
        },
        {
          "t": "label",
          "x": 5.2,
          "y": 4.2,
          "text": "R1",
          "size": 1.2
        },
        {
          "t": "mark",
          "x": 5.6,
          "y": 3.9,
          "r": 1.1
        }
      ]
    },
    "good": {
      "w": 16,
      "h": 8,
      "verdict": "good",
      "caption": "Референс над корпусом, площадки чисті.",
      "items": [
        {
          "t": "board",
          "x": 0,
          "y": 0,
          "w": 16,
          "h": 8
        },
        {
          "t": "part",
          "x": 5,
          "y": 3,
          "w": 3.2,
          "h": 1.6,
          "label": "",
          "kind": "res"
        },
        {
          "t": "pad",
          "x": 5.5,
          "y": 3.8,
          "w": 0.9,
          "h": 1.2,
          "net": "A"
        },
        {
          "t": "pad",
          "x": 7.7,
          "y": 3.8,
          "w": 0.9,
          "h": 1.2,
          "net": "B"
        },
        {
          "t": "label",
          "x": 6.6,
          "y": 2.4,
          "text": "R1",
          "size": 1,
          "anchor": "middle"
        }
      ]
    }
  },
  "enabled": true
}
