{
  "code": "DECOUPLING_FAR",
  "title": "Розв'язувальний конденсатор далеко від виводу",
  "category": "power",
  "severity": "warning",
  "summary": "Керамічний конденсатор живлення має стояти впритул до виводу мікросхеми, яку він обслуговує.",
  "description": "Для кожного конденсатора, у якого один вивід на землі, а другий на ланцюзі живлення, перевіряч шукає найближчий вивід мікросхеми на тому ж ланцюзі живлення й міряє відстань між центрами контактних площадок.\n\n- конденсатори до **220 nF** мають бути не далі `decoupling_max_dist_small`\n- більші (1 µF, 4.7 µF, 10 µF) вважаються об'ємними й мають ліміт `decoupling_max_dist_bulk`\n\nМікросхема визначається як корпус з префіксом `U` або з кількістю виводів не менше `ic_min_pads`.",
  "why": "Конденсатор корисний лише разом з петлею струму «вивід живлення → конденсатор → земля → вивід землі». Кожен міліметр цієї петлі додає приблизно 1 nH індуктивності. На фронтах перемикання ядра (сотні МГц) кілька наногенрі повністю блокують конденсатор: напруга на виводі просідає, з'являються збої, збільшується випромінювання.",
  "fix": "1. Поставте конденсатор так, щоб його площадка живлення була поруч з виводом мікросхеми, а не десь на трасі.\n2. Розводьте ланцюг у порядку **вивід → конденсатор → решта ланцюга**, а не відгалуженням від траси.\n3. Площадку землі конденсатора з'єднайте з полігоном землі перехідним отвором впритул (див. `DECOUPLING_GND_RETURN`).",
  "params": [
    {
      "key": "decoupling_max_dist_small",
      "label": "Макс. відстань для ≤220 nF",
      "unit": "мм",
      "type": "number",
      "default": 3.0,
      "min": 0.5,
      "max": 10,
      "step": 0.1
    },
    {
      "key": "decoupling_max_dist_bulk",
      "label": "Макс. відстань для об'ємних",
      "unit": "мм",
      "type": "number",
      "default": 8.0,
      "min": 1,
      "max": 30,
      "step": 0.5
    },
    {
      "key": "ic_min_pads",
      "label": "Мін. виводів, щоб вважати мікросхемою",
      "type": "number",
      "default": 8,
      "min": 2,
      "max": 64,
      "step": 1
    }
  ],
  "checker": {
    "engine": "pcbagent",
    "function": "check_decoupling",
    "measures": "відстань між центром площадки живлення конденсатора та найближчим виводом мікросхеми на тому ж ланцюзі"
  },
  "check": {
    "kernel": "decoupling",
    "emits": "DECOUPLING_FAR",
    "args": {}
  },
  "tags": [
    "розв'язка",
    "живлення",
    "MCU",
    "індуктивність петлі"
  ],
  "references": [
    {
      "title": "TI SLUA457: Power Supply Decoupling Capacitor Application Report",
      "url": "https://www.ti.com/lit/an/slua457/slua457.pdf"
    },
    {
      "title": "ST AN4938: Getting started with STM32H7 hardware development"
    }
  ],
  "examples": {
    "bad": {
      "w": 30,
      "h": 18,
      "verdict": "bad",
      "caption": "C1 стоїть за 9 мм від виводу VDD, траса живлення робить довгу петлю.",
      "items": [
        {
          "t": "board",
          "x": 0,
          "y": 0,
          "w": 30,
          "h": 18
        },
        {
          "t": "zone",
          "x": 0.5,
          "y": 0.5,
          "w": 29,
          "h": 17,
          "layer": "B",
          "net": "GND"
        },
        {
          "t": "part",
          "x": 2,
          "y": 3,
          "w": 10,
          "h": 10,
          "label": "U1",
          "kind": "ic"
        },
        {
          "t": "pad",
          "x": 12.6,
          "y": 5,
          "w": 1.2,
          "h": 0.5,
          "net": "VDD",
          "label": "VDD"
        },
        {
          "t": "pad",
          "x": 12.6,
          "y": 6,
          "w": 1.2,
          "h": 0.5,
          "net": "GND"
        },
        {
          "t": "part",
          "x": 22,
          "y": 3.6,
          "w": 2.2,
          "h": 1.2,
          "label": "C1",
          "kind": "cap"
        },
        {
          "t": "pad",
          "x": 22.3,
          "y": 4.2,
          "w": 0.6,
          "h": 0.8,
          "net": "VDD"
        },
        {
          "t": "pad",
          "x": 23.9,
          "y": 4.2,
          "w": 0.6,
          "h": 0.8,
          "net": "GND"
        },
        {
          "t": "track",
          "pts": [
            [
              13.2,
              5
            ],
            [
              22.3,
              5
            ],
            [
              22.3,
              4.2
            ]
          ],
          "w": 0.3,
          "layer": "F",
          "net": "VDD",
          "bad": true
        },
        {
          "t": "track",
          "pts": [
            [
              22.3,
              5
            ],
            [
              27,
              5
            ],
            [
              27,
              12
            ]
          ],
          "w": 0.3,
          "layer": "F",
          "net": "VDD"
        },
        {
          "t": "via",
          "x": 25.5,
          "y": 4.2,
          "net": "GND"
        },
        {
          "t": "track",
          "pts": [
            [
              23.9,
              4.2
            ],
            [
              25.5,
              4.2
            ]
          ],
          "w": 0.3,
          "layer": "F",
          "net": "GND"
        },
        {
          "t": "dim",
          "x1": 13.2,
          "y1": 8,
          "x2": 22.3,
          "y2": 8,
          "text": "9.1 мм > 3 мм"
        },
        {
          "t": "mark",
          "x": 23,
          "y": 4.2,
          "r": 1.8
        }
      ]
    },
    "good": {
      "w": 30,
      "h": 18,
      "verdict": "good",
      "caption": "C1 впритул до VDD; решта ланцюга живлення йде вже від конденсатора.",
      "items": [
        {
          "t": "board",
          "x": 0,
          "y": 0,
          "w": 30,
          "h": 18
        },
        {
          "t": "zone",
          "x": 0.5,
          "y": 0.5,
          "w": 29,
          "h": 17,
          "layer": "B",
          "net": "GND"
        },
        {
          "t": "part",
          "x": 2,
          "y": 3,
          "w": 10,
          "h": 10,
          "label": "U1",
          "kind": "ic"
        },
        {
          "t": "pad",
          "x": 12.6,
          "y": 5,
          "w": 1.2,
          "h": 0.5,
          "net": "VDD",
          "label": "VDD"
        },
        {
          "t": "pad",
          "x": 12.6,
          "y": 6,
          "w": 1.2,
          "h": 0.5,
          "net": "GND"
        },
        {
          "t": "part",
          "x": 14.2,
          "y": 3.6,
          "w": 2.2,
          "h": 1.2,
          "label": "C1",
          "kind": "cap"
        },
        {
          "t": "pad",
          "x": 14.5,
          "y": 4.2,
          "w": 0.6,
          "h": 0.8,
          "net": "VDD"
        },
        {
          "t": "pad",
          "x": 16.1,
          "y": 4.2,
          "w": 0.6,
          "h": 0.8,
          "net": "GND"
        },
        {
          "t": "track",
          "pts": [
            [
              13.2,
              5
            ],
            [
              14.5,
              5
            ],
            [
              14.5,
              4.2
            ]
          ],
          "w": 0.3,
          "layer": "F",
          "net": "VDD"
        },
        {
          "t": "track",
          "pts": [
            [
              14.5,
              4.2
            ],
            [
              14.5,
              2.2
            ],
            [
              27,
              2.2
            ],
            [
              27,
              12
            ]
          ],
          "w": 0.3,
          "layer": "F",
          "net": "VDD"
        },
        {
          "t": "via",
          "x": 17.2,
          "y": 4.2,
          "net": "GND"
        },
        {
          "t": "track",
          "pts": [
            [
              16.1,
              4.2
            ],
            [
              17.2,
              4.2
            ]
          ],
          "w": 0.3,
          "layer": "F",
          "net": "GND"
        },
        {
          "t": "dim",
          "x1": 13.2,
          "y1": 8,
          "x2": 14.5,
          "y2": 8,
          "text": "1.3 мм"
        }
      ]
    }
  },
  "enabled": true
}
