{
  "code": "PLANE_CUT",
  "title": "Сигнальні траси ріжуть земляний полігон",
  "category": "ground",
  "severity": "error",
  "summary": "На шарі із земляним полігоном не повинно бути довгих чужих трас: вони розривають шлях зворотного струму.",
  "description": "Перевіряч знаходить шар з найбільшим полігоном GND (або бере `plane_layer_hint`) і підсумовує довжину всіх трас не-GND ланцюгів на цьому шарі. Понад `plane_cut_warn_len` мм — попередження, понад `plane_cut_error_len` мм — помилка. У знахідці перелічуються найгірші ланцюги.",
  "why": "Зворотний струм кожного сигналу тече в полігоні прямо під сигнальною трасою. Якщо на його шляху лежить чужа траса, полігон розірваний: струм змушений обходити розрив, петля збільшується, сигнал дзвенить, а плата випромінює. На двошарових платах це головна причина проблем з EMC та збоїв при розводці автотрасувальником, який охоче кладе половину сигналів на нижній шар.",
  "fix": "1. Розводьте сигнали на верхньому шарі; нижній тримайте для суцільної землі.\n2. Якщо перетин неминучий, робіть його коротким і перпендикулярним.\n3. Для довгих обхідних трас краще пересунути компонент, ніж різати полігон.\n4. Після перерозведення перезалийте зони й перевірте, чи полігон не розпався на острови.",
  "params": [
    {
      "key": "plane_cut_warn_len",
      "label": "Поріг попередження",
      "unit": "мм",
      "type": "number",
      "default": 15,
      "min": 0,
      "max": 500,
      "step": 1
    },
    {
      "key": "plane_cut_error_len",
      "label": "Поріг помилки",
      "unit": "мм",
      "type": "number",
      "default": 60,
      "min": 0,
      "max": 2000,
      "step": 5
    },
    {
      "key": "plane_layer_hint",
      "label": "Шар полігону (порожньо = авто)",
      "type": "string",
      "default": ""
    }
  ],
  "checker": {
    "engine": "pcbagent",
    "function": "check_plane_cuts",
    "measures": "сумарна довжина трас не-GND на шарі земляного полігону"
  },
  "check": {
    "kernel": "plane_cuts",
    "emits": "PLANE_CUT",
    "args": {}
  },
  "tags": [
    "земля",
    "зворотний струм",
    "EMC",
    "двошарова плата"
  ],
  "references": [
    {
      "title": "Rick Hartley: How to Achieve Proper Grounding (Altium Expert Live Training, 2019)",
      "url": "https://www.youtube.com/watch?v=ySuUZEjARPY"
    }
  ],
  "examples": {
    "bad": {
      "w": 30,
      "h": 16,
      "verdict": "bad",
      "caption": "Сигнал на B.Cu проходить під шиною даних і розриває полігон.",
      "items": [
        {
          "t": "board",
          "x": 0,
          "y": 0,
          "w": 30,
          "h": 16
        },
        {
          "t": "zone",
          "x": 0.5,
          "y": 0.5,
          "w": 29,
          "h": 15,
          "layer": "B",
          "net": "GND",
          "cut": true
        },
        {
          "t": "part",
          "x": 2,
          "y": 4,
          "w": 6,
          "h": 8,
          "label": "U1",
          "kind": "ic"
        },
        {
          "t": "part",
          "x": 22,
          "y": 4,
          "w": 6,
          "h": 8,
          "label": "U2",
          "kind": "ic"
        },
        {
          "t": "track",
          "pts": [
            [
              8,
              6
            ],
            [
              22,
              6
            ]
          ],
          "w": 0.25,
          "layer": "F",
          "net": "D0"
        },
        {
          "t": "track",
          "pts": [
            [
              8,
              7
            ],
            [
              22,
              7
            ]
          ],
          "w": 0.25,
          "layer": "F",
          "net": "D1"
        },
        {
          "t": "track",
          "pts": [
            [
              8,
              8
            ],
            [
              22,
              8
            ]
          ],
          "w": 0.25,
          "layer": "F",
          "net": "D2"
        },
        {
          "t": "track",
          "pts": [
            [
              8,
              9
            ],
            [
              22,
              9
            ]
          ],
          "w": 0.25,
          "layer": "F",
          "net": "D3"
        },
        {
          "t": "track",
          "pts": [
            [
              15,
              1.5
            ],
            [
              15,
              14.5
            ]
          ],
          "w": 0.25,
          "layer": "B",
          "net": "NRST",
          "bad": true
        },
        {
          "t": "track",
          "pts": [
            [
              10,
              14.5
            ],
            [
              26,
              14.5
            ]
          ],
          "w": 0.25,
          "layer": "B",
          "net": "NRST",
          "bad": true
        },
        {
          "t": "via",
          "x": 15,
          "y": 1.5,
          "net": "NRST"
        },
        {
          "t": "via",
          "x": 26,
          "y": 14.5,
          "net": "NRST"
        },
        {
          "t": "arrow",
          "x1": 12,
          "y1": 12.5,
          "x2": 14.6,
          "y2": 10,
          "text": "зворотний струм обходить"
        },
        {
          "t": "mark",
          "x": 15,
          "y": 7.5,
          "r": 2.2
        }
      ]
    },
    "good": {
      "w": 30,
      "h": 16,
      "verdict": "good",
      "caption": "Той самий сигнал розведений на F.Cu, полігон суцільний.",
      "items": [
        {
          "t": "board",
          "x": 0,
          "y": 0,
          "w": 30,
          "h": 16
        },
        {
          "t": "zone",
          "x": 0.5,
          "y": 0.5,
          "w": 29,
          "h": 15,
          "layer": "B",
          "net": "GND"
        },
        {
          "t": "part",
          "x": 2,
          "y": 4,
          "w": 6,
          "h": 8,
          "label": "U1",
          "kind": "ic"
        },
        {
          "t": "part",
          "x": 22,
          "y": 4,
          "w": 6,
          "h": 8,
          "label": "U2",
          "kind": "ic"
        },
        {
          "t": "track",
          "pts": [
            [
              8,
              6
            ],
            [
              22,
              6
            ]
          ],
          "w": 0.25,
          "layer": "F",
          "net": "D0"
        },
        {
          "t": "track",
          "pts": [
            [
              8,
              7
            ],
            [
              22,
              7
            ]
          ],
          "w": 0.25,
          "layer": "F",
          "net": "D1"
        },
        {
          "t": "track",
          "pts": [
            [
              8,
              8
            ],
            [
              22,
              8
            ]
          ],
          "w": 0.25,
          "layer": "F",
          "net": "D2"
        },
        {
          "t": "track",
          "pts": [
            [
              8,
              9
            ],
            [
              22,
              9
            ]
          ],
          "w": 0.25,
          "layer": "F",
          "net": "D3"
        },
        {
          "t": "track",
          "pts": [
            [
              15,
              1.5
            ],
            [
              15,
              3
            ],
            [
              20,
              3
            ],
            [
              20,
              13.5
            ],
            [
              26,
              13.5
            ]
          ],
          "w": 0.25,
          "layer": "F",
          "net": "NRST"
        },
        {
          "t": "label",
          "x": 9,
          "y": 13.5,
          "text": "GND B.Cu без розривів",
          "size": 1
        }
      ]
    }
  },
  "enabled": true
}
