{
  "code": "NO_GND_PLANE",
  "title": "Немає залитого полігону землі",
  "category": "ground",
  "severity": "warning",
  "summary": "Двошарова плата без суцільної землі не має низькоімпедансного шляху зворотного струму.",
  "description": "Перевіряч шукає залиту (не rule-area) зону з ланцюгом GND/AGND/PGND. Якщо на платі з ≤ 2 мідними шарами такої зони немає, видається попередження. На чотирьох і більше шарах правило не спрацьовує, бо земля зазвичай є окремим шаром.",
  "why": "Без полігону кожен сигнал повертається по одній тонкій трасі GND, і всі петлі стають великими. Це шум по живленню, збої АЦП, чутливість до ESD і провал тестів на випромінювання.",
  "fix": "Додайте зону GND на нижньому шарі (і на верхньому там, де вільно), пріоритет 0, залийте. Перевірте, що зона з'єднана з усіма площадками GND і не розбилася на острови.",
  "params": [],
  "checker": {
    "engine": "pcbagent",
    "function": "check_plane_cuts",
    "measures": "наявність залитої зони GND на платі з ≤ 2 шарами"
  },
  "check": {
    "kernel": "plane_cuts",
    "emits": "NO_GND_PLANE",
    "args": {}
  },
  "tags": [
    "земля",
    "полігон",
    "двошарова плата"
  ],
  "references": [],
  "examples": {
    "bad": {
      "w": 24,
      "h": 14,
      "verdict": "bad",
      "caption": "Земля розведена окремими трасами, полігону немає.",
      "items": [
        {
          "t": "board",
          "x": 0,
          "y": 0,
          "w": 24,
          "h": 14
        },
        {
          "t": "part",
          "x": 2,
          "y": 3,
          "w": 6,
          "h": 6,
          "label": "U1",
          "kind": "ic"
        },
        {
          "t": "part",
          "x": 15,
          "y": 3,
          "w": 6,
          "h": 6,
          "label": "U2",
          "kind": "ic"
        },
        {
          "t": "track",
          "pts": [
            [
              8,
              5
            ],
            [
              15,
              5
            ]
          ],
          "w": 0.25,
          "layer": "F",
          "net": "SIG"
        },
        {
          "t": "track",
          "pts": [
            [
              8,
              8
            ],
            [
              11,
              8
            ],
            [
              11,
              12
            ],
            [
              18,
              12
            ],
            [
              18,
              9
            ]
          ],
          "w": 0.3,
          "layer": "F",
          "net": "GND",
          "bad": true
        },
        {
          "t": "mark",
          "x": 11,
          "y": 12,
          "r": 1.4,
          "text": "єдина траса GND"
        }
      ]
    },
    "good": {
      "w": 24,
      "h": 14,
      "verdict": "good",
      "caption": "Суцільна зона GND на нижньому шарі під усією платою.",
      "items": [
        {
          "t": "board",
          "x": 0,
          "y": 0,
          "w": 24,
          "h": 14
        },
        {
          "t": "zone",
          "x": 0.5,
          "y": 0.5,
          "w": 23,
          "h": 13,
          "layer": "B",
          "net": "GND"
        },
        {
          "t": "part",
          "x": 2,
          "y": 3,
          "w": 6,
          "h": 6,
          "label": "U1",
          "kind": "ic"
        },
        {
          "t": "part",
          "x": 15,
          "y": 3,
          "w": 6,
          "h": 6,
          "label": "U2",
          "kind": "ic"
        },
        {
          "t": "track",
          "pts": [
            [
              8,
              5
            ],
            [
              15,
              5
            ]
          ],
          "w": 0.25,
          "layer": "F",
          "net": "SIG"
        },
        {
          "t": "via",
          "x": 9,
          "y": 8,
          "net": "GND"
        },
        {
          "t": "via",
          "x": 14,
          "y": 8,
          "net": "GND"
        }
      ]
    }
  },
  "enabled": true
}
