{
  "code": "CRYSTAL_CAP_FAR",
  "title": "Навантажувальний конденсатор далеко від кварцу",
  "category": "clock",
  "severity": "warning",
  "summary": "Конденсатори C_L мають стояти поруч із кварцом, а не десь на трасі.",
  "description": "Для кожного конденсатора, підключеного до ланцюга кварцу, міряється відстань між центрами конденсатора й кварцу. Понад `crystal_cap_max_dist` мм — попередження.",
  "why": "Навантажувальна ємність задає частоту генератора. Якщо конденсатор далеко, паразитна ємність траси стає порівнянною з C_L, а земля конденсатора замикається через довгу петлю. Частота «пливе», гармоніки випромінюються.",
  "fix": "Поставте обидва конденсатори впритул до кварцу, їхні площадки GND об'єднайте однією короткою трасою з одним переходом на полігон (зіркова земля осцилятора).",
  "params": [
    {
      "key": "crystal_cap_max_dist",
      "label": "Макс. відстань конденсатора від кварцу",
      "unit": "мм",
      "type": "number",
      "default": 5,
      "min": 1,
      "max": 20,
      "step": 0.5
    }
  ],
  "checker": {
    "engine": "pcbagent",
    "function": "check_crystal",
    "measures": "відстань між центрами навантажувального конденсатора та кварцу"
  },
  "check": {
    "kernel": "crystal",
    "emits": "CRYSTAL_CAP_FAR",
    "args": {}
  },
  "tags": [
    "кварц",
    "конденсатор",
    "тактування"
  ],
  "references": [
    {
      "title": "ST AN2867: Oscillator design guide for STM8AF/AL/S, STM32 MCUs and MPUs",
      "url": "https://www.st.com/resource/en/application_note/an2867-oscillator-design-guide-for-stm8afals-stm32-mcus-and-mpus-stmicroelectronics.pdf"
    }
  ],
  "examples": {
    "bad": {
      "w": 22,
      "h": 12,
      "verdict": "bad",
      "caption": "C20 за 9 мм від Y1, земля конденсатора далеко.",
      "items": [
        {
          "t": "board",
          "x": 0,
          "y": 0,
          "w": 22,
          "h": 12
        },
        {
          "t": "zone",
          "x": 0.5,
          "y": 0.5,
          "w": 21,
          "h": 11,
          "layer": "B",
          "net": "GND"
        },
        {
          "t": "part",
          "x": 3,
          "y": 4,
          "w": 3.2,
          "h": 2.5,
          "label": "Y1",
          "kind": "xtal"
        },
        {
          "t": "track",
          "pts": [
            [
              3.3,
              5.2
            ],
            [
              3.3,
              9
            ],
            [
              15,
              9
            ]
          ],
          "w": 0.2,
          "layer": "F",
          "net": "OSC_IN",
          "bad": true
        },
        {
          "t": "part",
          "x": 15,
          "y": 8.5,
          "w": 1.6,
          "h": 1,
          "label": "C20",
          "kind": "cap"
        },
        {
          "t": "via",
          "x": 17.5,
          "y": 9,
          "net": "GND"
        },
        {
          "t": "track",
          "pts": [
            [
              16.4,
              9
            ],
            [
              17.5,
              9
            ]
          ],
          "w": 0.2,
          "layer": "F",
          "net": "GND"
        },
        {
          "t": "dim",
          "x1": 4.6,
          "y1": 3,
          "x2": 15.8,
          "y2": 3,
          "text": "11 мм > 5 мм"
        }
      ]
    },
    "good": {
      "w": 22,
      "h": 12,
      "verdict": "good",
      "caption": "Конденсатори впритул, спільна земля в одну точку.",
      "items": [
        {
          "t": "board",
          "x": 0,
          "y": 0,
          "w": 22,
          "h": 12
        },
        {
          "t": "zone",
          "x": 0.5,
          "y": 0.5,
          "w": 21,
          "h": 11,
          "layer": "B",
          "net": "GND"
        },
        {
          "t": "part",
          "x": 8,
          "y": 4,
          "w": 3.2,
          "h": 2.5,
          "label": "Y1",
          "kind": "xtal"
        },
        {
          "t": "part",
          "x": 12,
          "y": 3,
          "w": 1.6,
          "h": 1,
          "label": "C20",
          "kind": "cap"
        },
        {
          "t": "part",
          "x": 12,
          "y": 6.5,
          "w": 1.6,
          "h": 1,
          "label": "C21",
          "kind": "cap"
        },
        {
          "t": "track",
          "pts": [
            [
              11,
              4.5
            ],
            [
              12.2,
              3.5
            ]
          ],
          "w": 0.2,
          "layer": "F",
          "net": "OSC_IN"
        },
        {
          "t": "track",
          "pts": [
            [
              11,
              6
            ],
            [
              12.2,
              7
            ]
          ],
          "w": 0.2,
          "layer": "F",
          "net": "OSC_OUT"
        },
        {
          "t": "track",
          "pts": [
            [
              13.4,
              3.5
            ],
            [
              14.4,
              3.5
            ],
            [
              14.4,
              7
            ],
            [
              13.4,
              7
            ]
          ],
          "w": 0.3,
          "layer": "F",
          "net": "GND"
        },
        {
          "t": "via",
          "x": 14.4,
          "y": 5.25,
          "net": "GND"
        },
        {
          "t": "dim",
          "x1": 11.2,
          "y1": 9.5,
          "x2": 12.8,
          "y2": 9.5,
          "text": "1.5 мм"
        }
      ]
    }
  },
  "enabled": true
}
