{
  "code": "DECOUPLING_GND_RETURN",
  "title": "Земля конденсатора без перехідного отвору поруч",
  "category": "ground",
  "severity": "warning",
  "summary": "Площадка землі розв'язувального конденсатора має мати перехід на земляний полігон впритул, а не довгу трасу.",
  "description": "Для кожного розв'язувального конденсатора перевіряч дивиться, чи є в радіусі `decoupling_gnd_via_max_dist` від його площадки землі перехідний отвір ланцюга GND, наскрізна площадка GND або земляний полігон на тому ж шарі. Якщо нічого немає, рахується довжина траси землі від площадки й видається попередження.",
  "why": "Половина петлі розв'язки — це шлях від конденсатора до полігону землі. Траса завдовжки 3–5 мм додає стільки ж індуктивності, скільки далеке розміщення самого конденсатора. Найчастіша помилка на двошарових платах: конденсатор стоїть добре, а земля до нього приходить трасою через півплати.",
  "fix": "Поставте перехідний отвір GND впритул до площадки землі конденсатора (0.3–1 мм) і з'єднайте коротким сегментом. Ще краще два отвори паралельно для конденсаторів на ядрі. Якщо на верхньому шарі є земляний полігон, дайте площадці термальне або пряме з'єднання з ним.",
  "params": [
    {
      "key": "decoupling_gnd_via_max_dist",
      "label": "Макс. відстань до переходу GND",
      "unit": "мм",
      "type": "number",
      "default": 1.5,
      "min": 0.3,
      "max": 5,
      "step": 0.1
    }
  ],
  "checker": {
    "engine": "pcbagent",
    "function": "check_decoupling",
    "measures": "відстань від площадки GND конденсатора до найближчого перехідного отвору або полігону GND"
  },
  "check": {
    "kernel": "decoupling",
    "emits": "DECOUPLING_GND_RETURN",
    "args": {}
  },
  "tags": [
    "розв'язка",
    "земля",
    "перехідні отвори"
  ],
  "references": [
    {
      "title": "Henry Ott, Electromagnetic Compatibility Engineering, розділ 11"
    }
  ],
  "examples": {
    "bad": {
      "w": 24,
      "h": 14,
      "verdict": "bad",
      "caption": "Земля C1 йде трасою 6 мм до єдиного переходу.",
      "items": [
        {
          "t": "board",
          "x": 0,
          "y": 0,
          "w": 24,
          "h": 14
        },
        {
          "t": "zone",
          "x": 0.5,
          "y": 0.5,
          "w": 23,
          "h": 13,
          "layer": "B",
          "net": "GND"
        },
        {
          "t": "part",
          "x": 1,
          "y": 2,
          "w": 8,
          "h": 9,
          "label": "U1",
          "kind": "ic"
        },
        {
          "t": "pad",
          "x": 9.6,
          "y": 5,
          "w": 1.2,
          "h": 0.5,
          "net": "VDD",
          "label": "VDD"
        },
        {
          "t": "part",
          "x": 11,
          "y": 4.4,
          "w": 2.2,
          "h": 1.2,
          "label": "C1",
          "kind": "cap"
        },
        {
          "t": "pad",
          "x": 11.3,
          "y": 5,
          "w": 0.6,
          "h": 0.8,
          "net": "VDD"
        },
        {
          "t": "pad",
          "x": 12.9,
          "y": 5,
          "w": 0.6,
          "h": 0.8,
          "net": "GND"
        },
        {
          "t": "track",
          "pts": [
            [
              10.2,
              5
            ],
            [
              11.3,
              5
            ]
          ],
          "w": 0.3,
          "layer": "F",
          "net": "VDD"
        },
        {
          "t": "track",
          "pts": [
            [
              12.9,
              5
            ],
            [
              12.9,
              9
            ],
            [
              19,
              9
            ],
            [
              19,
              11
            ]
          ],
          "w": 0.25,
          "layer": "F",
          "net": "GND",
          "bad": true
        },
        {
          "t": "via",
          "x": 19,
          "y": 11,
          "net": "GND"
        },
        {
          "t": "dim",
          "x1": 12.9,
          "y1": 12.5,
          "x2": 19,
          "y2": 12.5,
          "text": "траса GND 10 мм"
        },
        {
          "t": "mark",
          "x": 12.9,
          "y": 5,
          "r": 1.4
        }
      ]
    },
    "good": {
      "w": 24,
      "h": 14,
      "verdict": "good",
      "caption": "Перехід GND впритул до площадки, петля мінімальна.",
      "items": [
        {
          "t": "board",
          "x": 0,
          "y": 0,
          "w": 24,
          "h": 14
        },
        {
          "t": "zone",
          "x": 0.5,
          "y": 0.5,
          "w": 23,
          "h": 13,
          "layer": "B",
          "net": "GND"
        },
        {
          "t": "part",
          "x": 1,
          "y": 2,
          "w": 8,
          "h": 9,
          "label": "U1",
          "kind": "ic"
        },
        {
          "t": "pad",
          "x": 9.6,
          "y": 5,
          "w": 1.2,
          "h": 0.5,
          "net": "VDD",
          "label": "VDD"
        },
        {
          "t": "part",
          "x": 11,
          "y": 4.4,
          "w": 2.2,
          "h": 1.2,
          "label": "C1",
          "kind": "cap"
        },
        {
          "t": "pad",
          "x": 11.3,
          "y": 5,
          "w": 0.6,
          "h": 0.8,
          "net": "VDD"
        },
        {
          "t": "pad",
          "x": 12.9,
          "y": 5,
          "w": 0.6,
          "h": 0.8,
          "net": "GND"
        },
        {
          "t": "track",
          "pts": [
            [
              10.2,
              5
            ],
            [
              11.3,
              5
            ]
          ],
          "w": 0.3,
          "layer": "F",
          "net": "VDD"
        },
        {
          "t": "track",
          "pts": [
            [
              12.9,
              5
            ],
            [
              14.1,
              5
            ]
          ],
          "w": 0.3,
          "layer": "F",
          "net": "GND"
        },
        {
          "t": "via",
          "x": 14.1,
          "y": 5,
          "net": "GND"
        },
        {
          "t": "dim",
          "x1": 12.9,
          "y1": 7,
          "x2": 14.1,
          "y2": 7,
          "text": "1.2 мм"
        }
      ]
    }
  },
  "enabled": true
}
